"","X","score","text","emotion","polarity"
"63",63,-2,"I purchased the 16 gigabyte version on sale for 89 dollars without ""special offers"". The 8 Gig version was 69 on sale without ""special offers"" What made it something I couldn't pass up... was the offer of a payment plan which I agreed to, and so I made the purchase, Having charged me the 89 dollars, the email they sent me now said I had bought the 8gb version. I tried to cancel the purchase. They said I could not. I was indeed sent an 8 gig version which I could have gotten for 69. Realizing they had just ripped me off for 20 bucks,  I proceeded to dispute the sale and recover the thing I had actually bought (a 16 Gig version) at the price I'd bought it, (89) and in the way I'd bought it, (on the payment plan). After days of explaining and arguing with mental deficients with a certain almost laughably greedy bent, I at least got what I had paid for. It wasn't easy by any means, and I through some amazing zeal to take from me anything they could....they did take away the payment deal and have charged me, all at once. I should mention that they also took a bit of my sanity also. That seemed to be the plan. Explaining the obvious over and over and over again to those who barely listen and comprehend less, is NOT fun.  New Egg will be getting more of my business whenever possible. A part of me now hates Amazon. They took alot of my time, a large part of a good deal from me, and lost a friend. You suck Amazon, and I'm a Prime member.","joy","neutral"
"64",64,-1,"What I didn't realize about the 8GB, was that over half of that was used up on system/operations. Got these for two of my children. They can't keep any more than a game or two and a movie on the device without the ""low storage"" warning coming up. Which it does, constantly. I am forever having to delete what little I can from the stupid thing so that they can use them. It also kicks you off of wifi any time the storage warning comes on.I currently have a kindle that I love, but these little tablets are very disappointing. If you are looking to purchase, be smart and upgrade to the higher memory. I wish I would have.","joy","negative"
"65",65,-2,"Up until now I have been a confirmed Kindle Junkie. I loved my Kindle Fire. But right out of the box, this one was slow (it takes between 30 and 50 seconds every time to load my library and the carousel), the back arrow button takes me out of the book not to the last location and it just now froze while I was trying to shut it down to see if that would fix the problems. Each of the last three Kindles I've purchased, the Paperwhite (gave it away), a regular Kindle (sitting in a cabinet) and this one, have just gotten worse. I don't know if this is an isolated incident or an indication of the future, but I think this is my 8th Kindle (several of them were warranty replacements) in 3 years, I'm not going to continue spending money on these readers that don't last very long even when they are working correctly.  I just now got off the phone returning this HD.","unknown","negative"
"66",66,2,"I received last night and my 2 year old son and I have been using non-stop. Everything is responsive and smooth. Big bump over last generation hd which I returned. It was so slow my two year old would walk away from it and take the previous generation from my 4 year old. Not a problem anymore. I love the 6 inch size, So far so good, can't beat for the price. I would recommend at least 16 gb.","joy","neutral"
"67",67,21,"My Fire hd 6 arrived this afternoon so I have just begun to test it.I'll update this review tomorrow after I have put its features through a bit more of a trial. But so far I'm delighted.I have a bit of experience with computers, Kindles, and Android tablets, so this is not, I hope, an uninformed review.First off, the tablet arrived in perfect condition, beautifully packaged. It was a joy to unbox and a cinch to set up. I plugged it into an outlet and watched as it automatically booted up for the first time. No problem. Neither was there any problem connecting to my existing Amazon account and gmail account. The system update took a while to download and install. And it took even longer to get the battery charged up fully (in part because I decided to use the tablet while it was charging.The tablet itself is a solid, well made slab. It feels like something that is not fragile and that will last. It's comfortable to hold in one hand with squared edges that don't jab into one's fingers the way the edges of my thinner Asus Memo Pad 10 tend to do. It is not a featherweight, but rather it weights exactly the advertised 10.1 ounces (the same as the venerable Kindle 2 it will largely replace).I purchased it primarily as an ereader and have tested that function. I rarely read in direct sunlight but often read in bed so the backlit screen is perfect for me. The text is very sharp and the entire Kindle reading experience is a joy. Text to speech in public domain books uses a pleasant female robo-voice. I'm quite happy with it. I haven't yet tried Audible books or audio books from my public library, but I'm quite certain they will work (after I fiddle around to install the Overdrive app). The single speaker is loud enough for most purposes.The Silk browser is fast and smooth. I'm using it to write this review and am very pleased with the implementation of the swipe keyboard for writing. Word prediction is accurate; the action is smooth. Web pages come up as quickly as they would on any of my laptop machines--maybe even a little more quickly.Amazon Prime videos load and play smoothly. The six inch screen is quite big enough for pleasant viewing, given that I wanted a light weight device I could easily skip in a coat pocket or a back pocket.I took a few test photos with the camera. It works, but it is only two megapixels. Still, I have found my two megapixel cell phone camera capable of taking surprisingly good macro photographs of wildflowers and insects. My initial results with this tablet's camera were a bit disappointing. But I have hopes of figuring out how to take better shots and will report back tomorrow.To be continued . . .I have updated and expanded this review on my blog page. (Google search for ""Lake Norfork Adventures"". Note the spelling of ""Norfork"" or else you won't find the page.) That review includes some tips for side-loading apps, but I devote most of my attention to the camera. I do a bit of macro nature photography to help in identifying wild flowers and insects. I've posted a few photos taken with this camera. It is surprisingly useful!","joy","positive"
"68",68,14,"Summary:  The games that you (or who you are giving this device to) probably won’t work on this device.  This includes Minion Rush, Angry Birds (Ad-Free), DoofenDash, Clash of Clans and many other big hits!  DO NOT BUY THIS DEVICE UNLESS YOU DON’T PLAY GAMES!!!I purchased 2 Kindle Fire HD 6 tablets as gifts for my boys for Christmas 2014.  Upon receiving them, I decided to get them all setup prior to wrapping so the kids can jump right in and use them after they are unwrapped.Upon getting them connected to my WIFI and registered on Amazon, I found that of the list of 20 games I was going to install on it, only 4 of them could be found in the Amazon App store from the device.  That didn’t sound right to me, so I searched for the apps in the web version of the Amazon App store from my pc.  Sure enough, the games are there, but it shows a little red ‘X’ next to my Kindle Fire HD 6 tablets in the compatibility section.  We are not just talking about a couple of no name games here, but large grossing games of the era are not compatible with this device.My next thought was that maybe I am doing something wrong here.  I am a geek by nature, have owned a few tablets in my time (iPad 1, iPad Mini, SG Tab 2) and I have android phones & 2 Amazon Kindle e-readers, so I was wondering that if I couldn't figure it out, how would someone without as much geek experience do it?Next, I got on the phone with Amazon Kindle Support.  Don’t get ahead of me.  Those of you who may have been on the phone with support may know where I am going.  During my 64 minutes 31 seconds on the phone, I spoke with five people, two of whom were managers, across two different departments.  Every time that I was transferred to someone new, the phone connection got quieter until person four… I couldn't even make out what they were saying.Here are the resolutions that I was giving by the support reps:- Person 1 (Kindle Support) – let’s get you to the app store support line to see if they have any clues (ok, maybe we can get somewhere here)- Person 2 (App Store Support) – well, if the game won’t install, just pick a different game and be done with it. (did not sit very well with me, mind you!)- Person 3 (App Store Support Manager) – well, it’s the app developers fault that they haven’t updated their games.  Why don’t you return the two 6 inch tablets and buy 7 inch tablets because the apps should work on those. Oh Wait, their all back ordered (“Yes, the gas doesn't work in this Chevy, go buy a Cadillac and it should work fine” --- again, not happy here)- Person 4 (Kindle Support again) – I couldn't understand her between the phone issues as well as her accent.  Rule #1 of customer service… support should help, not frustrate!- Person 5 (Kindle Support Manager) – The apps aren't compatible because of the Kindle Fire operating system that recently was released.  We are working to resolve the issue, but we do not have an ETA as to when the update will be available.Each person that I spoke with, I had to re-explain the problem all over again.  I refuse to accept the fact that a company the size of Amazon doesn’t have their house in order, but I guess I am wrong.  I am sitting on two Kindle Fire HD 6 tablets, which each have two games on them and running out of time for Christmas.Don’t make the same mistake that I did.  I thought that these would be simple and great tablets for my kids.  I WAS WRONG.  Heading back to what I know works and will NEVER buy another Amazon tablet again.","joy","neutral"
"69",69,8,"SlimPort...my reason to buy!  I still own the three previous Kindle Fires in 7"". Generation II  had HDMI out but whatever showed on the device appeared on the screen.  With SlimPort, only the media shows on the TV and IMDb info and other info like running time and battery status, etc. remains on the device.  Only Amazon content shows full screen however.  Netflix, HBOgo, and Hulu+ do not. Settings on whatever you use as a monitor can usually take care of that but for some, it's a hassle.  Amazon content was what I was mainly interested however...download overnight in HD and watch the next day without the interference associated MirrorCast or Second Screen.  Nothing beats downloading and a cable if your Wi-Fi isn't always stable.Enough people are giving the pros and cons of the Fire HD 6.  I love this little guy.  Got the 16GB (11.6 GB usable) version and wish it had more but I have enough Fires for games and such.  This lil' guy is strictly for video so it suits me just fine.  I'm a happy camper!SlimPort also works great with Amazon MP3's.  If you want to save space on the device, just download you music to a flash drive and using the proper adapter (http://www.amazon.com/gp/product/B00C452XFO/ref=oh_aui_detailpage_o09_s00?ie=UTF8&psc=1) or similar, you can play your favorites with no Wi-Fi necessary.  Amazon content will even display lyrics if originally available.  No need to use onboard storage.  This is good stuff!","joy","positive"
"70",70,16,"I love this thing! This wasn't bought for my daughter, or an elderly family member.I bought this for me and portability. For those that don't like the fact that the kindles don't offer TTS (text to speech) bam! It's here! Quickly hooks up to Bluetooth in the car. Easy to keep in my pocket, and with the affordable price not worrying about it getting beat up. It's tough well built and never plan on buying a case for it.To be honest I also bought it to feel what a new iPhone 6+ would feel like.Some gripes: Yes the camera isn't great but it's good enough. I do wish they would make taking pictures easier, like holding down the volume button or having it available from the start screen. Also I have a KDX and the icon for camera actually looks like a lens and not a brake rotor.Until today Hulu wasn't available, kudos! Now I need the WSJ application to work.So to wrap it up, nice portable on the go fire that isn't just for kids.","joy","positive"
"71",71,3,"Not a happy customer: Side-loading apps removes functionality. The Fire OS is inferior to Android OS in terms of usability. Furthermore, I am inhibited from using my google ecosystem on the Fire OS.Worst of all, the Kindle is pretty much a window into the shopping world of amazon, and I am constantly reminded that I need to buy things rather than being able to use the tablet simply for work purposes. I do not recommend","joy","positive"
"72",72,8,"The sheer value of this device cannot be understated. I got the 120$ 16GB model, and it doesn't feel like a single penny wasted.The 6 inch screen is a bit small, but wider than most phones of the same height and better suited for browsing, reading and viewing media. The clarity and colors in the screen are simply amazing for the price, any other device at 120$ would be lucky to look half as good.The device feels a bit thicker than it maybe should be, but as a result feels solid in your hand, almost like a real paperback book. I feel like if I dropped it, it wouldn't break immediately.Sometimes the software hiccups a bit, but I haven't noticed any significant slowdown. It runs most games just fine.The battery does what it promises, and lives about 8 hours of use.Again, for 120$, or just 99$ for the 8GB model, this can't be beat.","surprise","positive"
"73",73,1,"Bought for my toddler to watch Netflix/Youtube on trips and outings. The price was phemomenal and I had it in mind to purchase a second for myself. Much to my chagrin, this product is unacceptable for any adult with expectations of a good/great operating system.  Sturdy device, solid weight but not too heavy. My largest complaint is that It's more useful as a ""remote control"" for Amazon shopping more than anything else. There is no Google Play store, just copies of Apps that you would commonly find. The Freetime App for kids is more annoying and obtrusive-- what is the point of a kid's app that isnt intuitive for children who can not yet read? And the bargain basement versions of apps crash more frequently than cellphone and other tablet versions. It's stylish, has some interesting features (email docs directly to the Fire) but in my opinion, too much of the OS is devoted to continued shopping on Amazon (even when you pay 15 add'l dollars to turn the screensaver adds off)","anger","neutral"
"74",74,15,"For a first tablet, this works perfectly for me.I purchased this for one reason: to be able to read e-books in bed where it's warm. I have not been fond of reading stuff on the screen of my PC, so I wasn't all that certain the Fire would work for me; but it works wonderfully. I have already spent hours reading on it (I have had the Fire for about two weeks). The fact that I can also watch NBA games on this device, and the picture is HD clear, is a fabulous bit of icing on my cake.The camera seems to work just fine (I discovered the selfie view--holy cats, when did my nose get this big?). I can transfer photos to my PC easily (not the nose one). I had forgotten about the video-taking capacity and today was horrified to discover that I'd recorded a 60-second video when I first got the Fire, which was the quintessential ""old person with new technology"" show, including frighteningly clear mumbled narration. So that works. The deletion function works really well, too.For people who are technologically adept, yeah, I can't tell you what you want to know about this device.  But, even considering how low my expectations were for any e-book reader, I am exceedingly delighted with my new toy.","joy","positive"
"75",75,6,"I purchased this small kindle fire as a supplemental e-reader for when I was too lazy to use my surface 2. However, after playing with this adorable little tablet I am pleasantly surprised at just how capable it is!While the device looks a little chunky, the weight feels appropriate in the hand and is distributed evenly across the device. The screen, while only 6 inches across, is absolutely stunning for watching movies. The user-interface is what you can expect from Amazon's proprietary forked android software~ but unlike previous iterations of the Kindle Fire the transitions seem much smoother and all-around ""zippier.""The speaker on this tablet is not the best, nor is it the worst. If I had to draw a comparison~ it is probably on-par with many high-end tablets from 2012 that were quadruple the price. Appstore selection is ""okay"" and you still have the option of side-loading android apk's onto the device if the appstore doesn't have them.For the price you pay, you are getting a hard-working bundle of fun that literally fits into your pocket. Amazon did a great job designing this device.","joy","neutral"
"76",76,12,"I love this little guy he's got the display witch is Amazing there's really no pixels that can been seen on the screen the battery life is ok good for a 120 dollar tablet the fire os4 is great too I had an HDX and I love it but I needed something more portable for reading and this fit the bill I would.buy this if you love kindled than you'll love this little guy EDIT hey guys I also forgot to addThe speaker part of the review there are so much better than my HDX 7 they have better sound overall but the HDX 7s speakers always sucked not a surprise but overall everything on this tablet is just flipping awesome OS fire 4.0. The speakers. The display. The new and improved silk browser. Just everything this tablet is worth so much more than 99 dollars buy the 16:-/ though the 8:-/ only has 4gb of actual user storage so not much storage for anything really at least with the 16gb you get 11.6gb of user storage","joy","positive"
"77",77,18,"I cannot tell you how much I love the Kindle Fire HD 6""! The clarity of the screen is extremely impressive for as small as it is. That part surpassed all my expectations. It has convenient volume buttons on the side and from what I can tell, the speaker quality is pretty good for something so tiny. It fits perfectly in my purse so I can take it anywhere with me and it is on the light side, so it doesn't weigh my bag down.My all time favorite feature on this is the Goodreads button! I have been saying for a few years now how much easier it would be if eReaders synced right up to Goodreads and it finally happened. Instead of logging onto Goodreads to update my progress or to add a new book to my currently reading shelf, all I have to do is tap the screen, hit the Goodreads button, and I can update everything from there. It even tells me about how long it takes the average reader to read the book I'm currently on. Maybe it's the book nerd in me, but I was so excited about that feature that I literally shouted out loud in excitement when I saw it.Another feature that spoke to the bibliophile in me was the related books feature. As you are on the home screen, scrolling through books, it will show you a few other books you may be interested in purchasing based on the subject of that book. I received this in exchange for an honest review and my 100% honest opinion is that compared to the original Kindle Fire with the 7 inch screen that I already had, this is by far my favorite one. I highly recommend it. If you are mainly using it for reading, you will get over it's small size rather quickly when you see the amazing features and incredible screen quality.","joy","positive"
"78",78,16,"This has quickly become my favorite tablet. I own every version of the Kindle line-up from the original Kindle Fire, right up to the HDX 8.9 and HDX 7 inch. I also have an Ipad 2 and an Ipad Mini, both of which are gathering dust because I prefer to use the Kindle HDX 8.9, which is lighter, faster, and easier to transfer files directly from my PC. I did not expect the HD 6 to be as good as it is, but now I can’t do without it. It is easy to hold and transport, and fits nicely into a small bag. The screen clarity is excellent, wifi is faster than previous versions, and the sound is much better than I expected. In fact, I think music sounds better on the HD 6 than the HDX 7, which by the way is the only Amazon tablet I have regretted buying. I should have returned the HDX, because the blue haze around the edges made the device virtually unusable. Comparing the HD 6 and the HDX 7, I would say the HD 6 is far better in quality, and less than half the price of the HDX, at least when I bought the HDX last year. Moreover, the HD 6 has both rear and front cameras, and while I don’t use them much, I find the picture capability suits my limited purposes, such as scanning receipts and other documents. Battery life is comparable with previous versions, not better or worse.One other point is worth making, since I haven’t heard other reviewers comment on it. Text on the HD 6 is remarkably readable. Before I bought the Fire, I feared that text would too small to read on a 6 inch screen. But the software upgrades have made a huge difference. Reading newspapers and magazines on the Fire is a real pleasure. The text size automatically adjusts to the screen, so that if you enlarge text you can read everything in one screen, rather than seeing portions of a line as before. The same thing is true with documents, especially if you use the WPS Office on the Fire. I can read my Word documents just as easily on a 6 inch screen as on the 8.9 one.I am very happy with the Fire HD 6. The HDX 8.9 is still the king of Amazon’s tablets, and it has replaced my laptop when I travel. The Fire HD 6 is a close second. Don’t hesitate to buy it. You won’t be disappointed, and you will be surprised how quickly it will become your preferred device.","joy","positive"
"79",79,12,"Good for travel and consuming Amazon content. I wanted this small Fire for when I fly and want to watch TV or movies. Most of the content provided by the airlines is old or low quality. Since I have a prime account I can choose from a fair selection to load for free.  I was pleasantly surprised that even the ""good"" mode gives a pretty clear picture.  I tested it with the pilot episode of the Sopranos - it's a good picture, took just below 400mb.  I got the 16GB fire so I can easily fit 20 similar episodes which would cover any domestic trip including airport stops.  One warning, video has an expiry date which for the Sopranos was three days.Overall performance was good.  I was impressed by the email app that came with it, I found and set up my office email no problem. It's not thin and light, rather heavy.  Not for carrying around with you in a pocket for long times. It's a limited android, the apps available without rooting or side loading are not extensive. Youtube worked well.  The biggest weakness is that it doesn't have Google apps or Google docs. The app store is small. I'd recommend it if 1) you are a Prime member and 2) you want it mainly to consume Amazon content and 3) you don't need Google apps.Best part it is cool to be able to download for free so many videos and prime music, keeping in touch with email, and the office-type suite apps you can buy to view office docs. I got Mobisystems Office Suite 7 pro and when a co-worker sent me a word doc attachment to my email it opened easily.  Also basic photo apps and of course books are there. I use Apple devices normally so it did take a day to get used to using the Android style interface.It automatically loaded my kindle books no problem.  Wifi connectivity worked well.I would actually rate this 4 and a half stars with half a star off for missing a broad range of Android apps especially Google apps.","joy","neutral"
"80",80,-1,"Very Disappointed! I purchased my Fire new a few weeks ago. A couple of days after I purchased it the screen would go black while I was trying to play a game or view anything online. I had to continuously restart it by pressing the power button. I noticed that the problem got worse if I was hand holding it. If it was laying on a flat surface it would still shut off on its own but not as frequently.I did the 40 second restart. I did it 4 times and the problem continued. I chatted with a customer service person at the Amazon site. While she was very nice/helpful, the problem continued. Basically, my Kindle Fire 6 HD is almost impossible to use as I can't view anything for more than 15 seconds without it going black, then switching to the ""recommended ads screen"". I tried disabling this feature thinking it might help, but the problem continues.I purchased an off-brand, Android based inexpensive tablet for my kid and it works perfectly compared to my Fire. My wife's old off-brand, Android based tablet also works flawlessly.  I really wanted to like this tablet, but I am truly frustrated with it. My next step will be to contact customer service yet again. I'm seriously thinking about giving up  and returning it.","joy","negative"
"81",81,7,"I am not a computer master.  I am a middle aged mom who likes to read, surf the internet, do some Facebooking and messaging.  So perfect is not so important for me.... I see no problems or drawbacks with this product.  I LOVE IT.  I have other kindles.  This one is just a little larger than my phone, and does so many things I love to do.  Great size for pocketting or pursing!  The portability meets my needs perfectly!  Loving my newest Kindle!","joy","positive"
